<?xml version='1.0' encoding='ISO-8859-1' ?>
<MdsExampleTest xmlns="urn:mpeg:mpeg7:schema:2001"
                xmlns:xsi="http://www.w3.org/2001/XMLSchema-instance"
                xmlns:mpeg7="urn:mpeg:mpeg7:schema:2001"
                xsi:schemaLocation="urn:mpeg:mpeg7:schema:2001 .\examples.xsd">

   <ColorSpace type="RGB"/>

   <ColorSpace type="YCbCr" colorReferenceFlag="true"/>

   <ColorSpace type="HSV"/>

   <ColorSpace type="HMMD" colorReferenceFlag="true"/>

   <ColorSpace type="LinearMatrix" colorReferenceFlag="true">
      <ColorTransMat>1 1 1 1 1 1 1 1 1</ColorTransMat>
   </ColorSpace>

   <ColorSpace type="Monochrome" colorReferenceFlag="true"/>


</MdsExampleTest>
